id,name,name_en,muscle_group,instructions,equipment,secondary_muscles
1407ee89-9cf7-4a83-815b-da6eb0960448,Good mornings,Good Mornings,Ischios,"{""setup"":[""Débutez debout avec les pieds écartés à la largeur des hanches"",""Gardez le dos droit et les épaules basses"",""Engagez vos abdominaux pour maintenir la stabilité du corps""],""movement"":[""Inclinez-vous en avant en pliant les hanches, en gardant les genoux légèrement fléchis"",""Descendez jusqu'à ce que votre torse soit parallèle au sol"",""Relevez-vous à la position initiale en contractant les muscles ischio-jambiers""],""breathing"":[""Inspirez lorsque vous vous inclinez en avant"",""Expirez lorsque vous vous redressez"",""Respirez de manière naturelle et régulière tout au long de l'exercice""],""common_mistakes"":[""Ne pas garder le dos droit et les épaules basses"",""Fléchir trop les genoux et ne pas engager les ischio-jambiers"",""Bouger trop vite et ne pas contrôler le mouvement""]}",bodyweight,
00632042-ea0c-40a9-837e-4728bf3056bd,Hack squats,Hack Squats,Quadriceps,"{""setup"":[""Prenez une position debout avec les pieds écartés, les bras le long du corps."",""Prenez une barre ou une haltère derrière la cuisse, en tenant fermement."",""Assurez-vous que votre dos est droit et que votre tête est alignée avec votre colonne vertébrale."",""Placez vos pieds à l'angle de 90 degrés, les orteils légèrement tournés vers l'avant.""],""movement"":[""Passez à la position assise en baissant le corps tout en gardant les genoux écartés."",""Descendez lentement en gardant les genoux écartés et les orteils pointés vers l'avant."",""Poussez-vous de nouveau vers la position debout en contractant les quadriceps."",""Répétez pour un total de 10 à 15 répétitions.""],""breathing"":[""Respirez profondément pendant la descente et expirez pendant la poussée.""],""common_mistakes"":[""Ne pas garder les genoux écartés peut entraîner une surcharge sur les genoux."",""Ne pas maintenir une position droite peut entraîner une mauvaise posture et une surcharge sur le dos."",""Ne pas utiliser les quadriceps pour se relever peut entraîner une mauvaise technique et une inefficacité.""]}",bodyweight,Ischios; Mollets; Fessiers
687fd7c2-046e-4e60-a5a1-761073771e6d,Haltères sur scott machine,Dumbbells on Scott Machine,Biceps,"{""setup"":[""Assis sur la machine, placez vos pieds solidement sur les étriers."",""Saisissez les haltères avec vos mains en position supin."",""Assurez-vous que votre dos est bien appuyé contre le coussin."",""Maintenez votre corps stable et votre tête droite.""],""movement"":[""Lever doucement les haltères vers votre poitrine tout en contractant vos biceps."",""Maintenez la position pendant un court instant."",""Relâchez lentement les haltères en les ramenant vers le bas."",""Répétez l'exercice pour atteindre le nombre de répétitions souhaité.""],""breathing"":[""Respirez profondément et régulièrement tout au long de l'exercice."",""Inspirez lors de la phase de descente et expirez lors de la phase d'ascension.""],""common_mistakes"":[""Ne plissez pas le dos ou la tête pendant l'exercice."",""Ne faites pas d'excès de mouvement avec les hanches."",""Assurez-vous de ne pas utiliser un poids trop lourd qui pourrait entraîner une mauvaise technique.""]}",bodyweight,
59015623-36d6-4a7f-b728-1c4d163221c6,Hammerstrength decline chest press,Hammerstrength Decline Chest Press,Pectoraux,"{""setup"":[""Placez-vous sur la machine en position inclinée vers le bas."",""Saisissez les manettes avec vos mains en forme de poing."",""Étirez vos jambes et placez vos pieds sur le support."",""Assurez-vous que votre dos est bien appuyé contre le dossier.""],""movement"":[""Poussez doucement les manettes vers le haut en gardant vos coudes près de votre corps."",""Conservez une position de poignet neutre tout au long de l'exercice."",""Revenez lentement à la position initiale en contrôlant le mouvement."",""Répétez pour atteindre le nombre de répétitions souhaité.""],""breathing"":[""Respirez profondément et lâchez lentement l'air pendant la phase de poussée."",""Inspirez pendant la phase de descente.""],""common_mistakes"":[""Ne plissez pas vos coudes pour effectuer le mouvement."",""Ne roulez pas vos épaules vers l'avant pendant la phase de poussée."",""Ne laissez pas vos hanches sortir de la position de départ.""]}",bodyweight,Épaules; Triceps
c67f6e00-abd3-4856-8849-be798d46d639,Hamstring chokes,Hamstring Chokes,Ischios,"{""setup"":[""Commencez allongé sur le dos"",""Pliez les genoux et ramenez les talons vers les fessiers"",""Maintenez le dos plat contre le sol""],""movement"":[""Contractez les ischio-jambiers pour ramener les talons vers les fessiers"",""Maintenez la contraction pendant quelques secondes"",""Répétez le mouvement pour plusieurs répétitions""],""breathing"":[""Respirez normalement pendant l'exercice"",""Expirez lors de la contraction des ischio-jambiers"",""Inspirez lors du relâchement""],""common_mistakes"":[""Ne pas maintenir le dos plat contre le sol"",""Ne pas contracter suffisamment les ischio-jambiers"",""Faire bouger les hanches pendant le mouvement""]}",bodyweight,
de8de0e3-ea45-4749-b22c-274d1477a6f1,Helms row,Helms Row,Dos,"{""setup"":[""Assis sur une chaise avec les pieds solidement plantés au sol"",""Tenir un dumbbell avec les deux mains, bras tendus vers le bas"",""Maintenir une position droite du dos et de la colonne vertébrale""],""movement"":[""Pulser le dumbbell vers le haut en tirant avec le dos"",""Concentrer l'effort sur le haut du dos et les omoplates"",""Redescendre lentement le dumbbell en contrôlant le mouvement""],""breathing"":[""Respirer profondément et régulièrement tout au long de l'exercice"",""Exhaler lors de la phase de contraction musculaire"",""Inhaler lors de la phase de descente""],""common_mistakes"":[""Ne pas maintenir une position droite du dos"",""Utiliser le mouvement du cou pour aider à lever le poids"",""Ne pas contrôler le mouvement de descente""]}",dumbbell,Trapèzes
8e7d5e22-1327-40f1-b872-a87bfade6814,High knee skips HD,High Knee Skips HD,Abdos,"{""setup"":[""Prenez une position debout avec les pieds écartés d'environ la largeur des hanches."",""Levez les bras le long du corps pour maintenir l'équilibre."",""Assurez-vous que vos pieds sont légèrement en dehors de l'alignement des genoux.""],""movement"":[""Commencez par soulever un genou vers votre poitrine en frappant le sol du pied opposé."",""Alternez rapidement les jambes en sautant légèrement."",""Concentrez-vous sur la vitesse et la coordination des mouvements."",""Assurez-vous que vos genoux restent droits tout au long du mouvement.""],""breathing"":[""Respirez naturellement en alternance avec les sauts."",""Ne retenez pas votre respiration.""],""common_mistakes"":[""Ne pas maintenir une position droite des genoux."",""Sauter trop haut, ce qui peut entraîner une perte d'équilibre."",""Ne pas alternater correctement les jambes.""]}",bodyweight,Biceps; Fessiers; Quadriceps; Triceps
f50390a2-022f-4911-9ba3-0f96f1d36670,Hip hinge,Hip hinge,Ischios,"{""setup"":[""Tenez la barre avec les mains écartées de la largeur des épaules"",""Les pieds sont écartés de la largeur des hanches"",""Le dos est droit et les épaules sont basses""],""movement"":[""Pliez les hanches en gardant le dos droit"",""Abaissez la barre le long des cuisses jusqu'aux genoux"",""Poussez à travers les hanches pour revenir à la position initiale""],""breathing"":[""Inspirez lors de la descente"",""Expirez lors de la remontée"",""Respirez naturellement et évitez de retenir votre souffle""],""common_mistakes"":[""Cambrer le dos ou arrondir les épaules"",""Ne pas plier suffisamment les hanches"",""Laisser la barre s'écarter des cuisses""]}",barbell,Mollets; Quadriceps; Abdos
f2d5b9d8-2492-4811-8b35-1dfdf6079d70,Hip thrust barre,Barbell Hip Thrust,Fessiers,"{""setup"":[""Assis sur la barre avec les pieds sur le sol, les genoux à angle droit."",""Placez les hanches sur la barre, les fessiers au-dessus de la barre."",""Assurez-vous que vos pieds sont bien ancrés et que vos hanches sont alignées avec vos épaules."",""Prenez une prise sur la barre avec vos mains pour stabiliser.""],""movement"":[""Poussez vos hanches vers le haut en gardant les genoux à angle droit."",""Concentrez-vous sur l'extension des fessiers."",""Ne poussez pas avec vos genoux, mais avec vos fessiers."",""Revenez lentement à la position initiale.""],""breathing"":[""Respirez profondément pendant la phase de descente."",""Exhale lentement pendant la phase de poussée.""],""common_mistakes"":[""Ne pas utiliser les genoux pour pousser, mais les fessiers."",""Ne pas maintenir une position verticale des hanches."",""Ne pas contrôler le mouvement pendant la descente.""]}",barbell,
45bf2f85-441d-4332-ad44-4a75fcbdc67e,Hip thrust haltère,Dumbbell Hip Thrust,Fessiers,"{""setup"":[""Assis sur une chaise avec les pieds sur le sol, les genoux à angle droit."",""Prenez un haltère dans chaque main et placez-le sur vos cuisses."",""Appuyez sur vos talons et maintenez votre dos droit."",""Assurez-vous que votre tête, vos épaules et votre bassin sont alignés.""],""movement"":[""Poussez vos fesses vers le haut tout en gardant vos genoux à angle droit."",""Concentrez-vous sur l'extension de vos fessiers."",""Revenez lentement à la position initiale."",""Répétez pour un total de 3 séries de 10 à 15 répétitions.""],""breathing"":[""Respirez profondément pendant la phase de descente."",""Exhale lentement pendant la phase de poussée.""],""common_mistakes"":[""Ne plissez pas les hanches vers l'avant."",""Ne laissez pas vos genoux s'ouvrir vers l'extérieur."",""Assurez-vous de ne pas utiliser vos jambes pour faire la poussée.""]}",dumbbell,
4107fbd3-1d99-4ca3-8c08-156e26fea3ec,Hip thrust unilatéral,Unilateral Hip Thrust,Fessiers,"{""setup"":[""Assis sur une chaise avec une jambe repliée et le talon sur le fessier"",""La jambe droite est étendue devant vous avec les orteils pointés vers le haut"",""Appuyez sur le fessier et la chaise pour maintenir votre dos droit"",""Gardez le tronc vertical et les épaules bien en arrière""],""movement"":[""Poussez avec la cuisse inférieure pour soulever le fessier vers le haut"",""Conservez une ligne droite de la cheville au fessier"",""Poussez jusqu'à ce que la cuisse supérieure soit parallèle au sol"",""Ralentissez le mouvement en abaissant doucement le fessier vers le bas""],""breathing"":[""Respirez profondément et lissez votre respiration tout au long de l'exercice"",""Inspirez lors de la phase de descente et expirez lors de la phase de poussée""],""common_mistakes"":[""Ne pas maintenir une ligne droite de la cheville au fessier"",""Utiliser les mains pour soutenir le poids du corps"",""Ne pas contrôler le mouvement en descendant"",""Faire l'exercice avec une vitesse trop rapide""]}",bodyweight,Abdos
4607b2bd-ff63-4794-b3fb-d0239cf6fcd5,Hip thrust unipodal haltère,Dumbbell Single-leg Hip Thrust,Fessiers,"{""setup"":[""Assis sur une chaise avec une jambe repliée et le talon sur le fessier"",""La jambe droite est étendue devant vous avec le talon appuyé sur le sol"",""Prenez un haltère dans la main opposée à la jambe repliée"",""Gardez le dos droit et la colonne vertébrale bien alignée""],""movement"":[""Poussez le fessier vers le haut tout en gardant la colonne vertébrale droite"",""Concentrez-vous sur l'extension du fessier"",""Ramenez doucement le fessier vers le sol"",""Répétez pour le nombre de répétitions prescrit""],""breathing"":[""Respirez profondément et lissez votre respiration tout au long de l'exercice"",""Inspirez lors de la phase de descente et expirez lors de la phase de poussée""],""common_mistakes"":[""Ne pas maintenir une colonne vertébrale droite"",""Utiliser le tronc pour aider à la poussée au lieu de l'extension des fessiers"",""Ne pas contrôler la descente"",""Utiliser un poids trop lourd""]}",barbell,Ischios; Quadriceps
6f0a582c-a65a-4115-8002-c1621ca6ab03,Hollow hold,Hollow Hold,Abdos,"{""setup"":[""Allongez-vous sur le dos avec les bras tendus au-dessus de la tête"",""Engagez vos abdominaux en rentrant le nombril vers la colonne vertébrale"",""Maintenez les jambes légèrement fléchies""],""movement"":[""Soulevez les épaules et les jambes du sol en gardant le corps tendu"",""Maintenez la position en gardant les abdominaux engagés"",""Respirez normalement tout en maintenant la position""],""breathing"":[""Respirez normalement en inspirant par le nez et en expirant par la bouche"",""Évitez de retenir votre respiration pendant l'exercice""],""common_mistakes"":[""Ne pas engager suffisamment les abdominaux"",""Laisser les épaules ou les jambes toucher le sol"",""Respirer de manière irrégulière""]}",bodyweight,
d66c2cb0-a5e2-4e1b-b03f-00c4b854d5ca,Hyper Y W combo,Hyper Y W Combo,Dos,"{""setup"":[""Commencez en position de Y, les bras étendus vers le haut."",""Passez ensuite à la position de W, les bras étendus vers l'avant."",""Assurez-vous que votre corps forme un angle droit avec le sol."",""Maintenez votre tête et votre cou alignés avec votre dos.""],""movement"":[""Passez doucement de la position de Y à W, en gardant le contrôle."",""Concentrez-vous sur l'extension de vos épaules et de votre dos."",""Faites 10 répétitions en alternant entre Y et W."",""Assurez-vous de maintenir une respiration régulière tout au long de l'exercice.""],""breathing"":[""Respirez profondément et régulièrement tout au long de l'exercice."",""Inspirez lors de la transition de Y à W, expirez lors de la transition de W à Y.""],""common_mistakes"":[""Ne pas maintenir une respiration régulière peut entraîner une fatigue prématurée."",""Ne pas contrôler les mouvements peut entraîner une mauvaise posture et une surcharge inutile des muscles."",""Ne pas maintenir l'alignement de la tête et du cou peut entraîner des douleurs cervicales.""]}",bodyweight,
3e05282d-2c2f-45b1-8abc-bee79e99004b,Hyperextension inversée,Reverse Hyperextension,Ischios,"{""setup"":[""Placez-vous sur le banc avec les pieds sur les supports."",""Étendez vos jambes tout en gardant vos hanches en contact avec le banc."",""Assurez-vous que votre dos est bien plat contre le banc."",""Saisissez les poignées si disponibles, sinon maintenez-vous en position.""],""movement"":[""Lever vos hanches vers le plafond en contractant vos ischios."",""Descendez lentement en contrôlant le mouvement."",""Répétez pour le nombre de répétitions prescrits.""],""breathing"":[""Respirez profondément pendant la contraction."",""Exhale lentement pendant la descente.""],""common_mistakes"":[""Ne pas maintenir les hanches en contact avec le banc."",""Utiliser le mouvement du tronc au lieu de celui des ischios."",""Ne pas contrôler la descente.""]}",bench,
94f094e9-7ae6-4b20-a863-67dac0d4417e,Ice cream maker,Ice Scream maker,Dos,"{""setup"":[""Commencez en position de planche, les bras étendus et les jambes relevées avec les orteils pointés."",""Assurez-vous que votre corps forme une ligne droite de la tête aux chevilles."",""Placez vos mains légèrement en dehors de vos épaules pour une stabilité accrue."",""Respirez calmement et profondément tout au long de l'exercice.""],""movement"":[""Pendant l'exercice, concentrez-vous sur le mouvement de vos hanches et de vos fessiers."",""Descendez lentement en faisant pivoter vos hanches vers le bas, tout en gardant vos bras immobiles."",""Remontez lentement en contractant vos fessiers et vos muscles du dos."",""Répétez pour un total de 10 à 15 répétitions.""],""breathing"":[""Respirez calmement et profondément tout au long de l'exercice."",""Inspirez lorsque vous descendez et expirez lorsque vous remontez.""],""common_mistakes"":[""Ne permettez pas vos hanches de se soulever ou de s'abaisser trop bas."",""Assurez-vous de maintenir une position stable tout au long de l'exercice."",""Évitez de contracter vos muscles du cou ou de la tête pour maintenir votre stabilité.""]}",bodyweight,Abdos
4f7084b0-de18-40be-a864-be3ddae0695b,Incline chest press DB,Incline Chest Press DB,Pectoraux,"{""setup"":[""Assis sur une machine d'inclinaison, placez-vous à angle de 30 degrés."",""Prenez un dumbbell dans chaque main, les bras tendus vers le haut."",""Placez votre dos sur le coussin, vos pieds sur le sol."",""Assurez-vous que votre tête, votre dos et vos fesses sont en contact avec le coussin.""],""movement"":[""Poussez les dumbbells vers le plafond en gardant les coudes légèrement pliés."",""Concentrez-vous sur le mouvement des pectoraux."",""Ramenez doucement les dumbbells vers votre poitrine."",""Ne pliez pas trop les coudes pour éviter les blessures.""],""breathing"":[""Respirez profondément pendant la phase de poussée."",""Exhale lentement pendant la phase de ramenement.""],""common_mistakes"":[""Ne pliez pas trop les coudes, cela peut entraîner des blessures."",""Assurez-vous de maintenir une bonne posture tout au long de l'exercice."",""Ne faites pas d'excès de poids, utilisez un poids approprié pour éviter les blessures.""]}",dumbbell,Triceps
eb0ed8b1-092b-4192-9f2f-f85f44db47ec,Incline smith press,Incline Smith Press,Pectoraux,"{""setup"":[""Placez-vous sur le banc incliné à 45 degrés."",""Saisissez le barre avec les mains à la largeur des épaules."",""Assurez-vous que votre dos est bien appuyé contre le banc."",""Étirez vos jambes et placez vos pieds solidement sur le sol.""],""movement"":[""Inspirez et soulèvez le barre vers le haut en gardant vos coudes légèrement fléchis."",""Conservez une position stable et contrôlée tout au long du mouvement."",""Descendez lentement le barre en inspirant."",""Concentrez-vous sur l'extension des épaules tout en soulevant le barre.""],""breathing"":[""Inspirez profondément lorsque vous descendez le barre."",""Exhale lentement lorsque vous soulèvez le barre.""],""common_mistakes"":[""Ne pas maintenir une position stable du corps."",""Utiliser un poids trop lourd pour effectuer le mouvement."",""Ne pas contrôler le mouvement lors de la descente.""]}",bench,
1f06c39a-9bae-4cbf-bf71-6de7b874e06e,Incliner ohp DB,Incline OHP DB,Épaules,"{""setup"":[""Placez-vous devant un banc incliné à 45 degrés."",""Prenez un dumbbell dans chaque main avec vos paumes tournées vers vous."",""Placez vos pieds à hauteur de vos épaules, légèrement écartés."",""Assurez-vous que votre dos est droit et que votre tête est alignée avec votre colonne vertébrale.""],""movement"":[""Lever les dumbbells au-dessus de votre tête en gardant vos coudes légèrement fléchis."",""Conservez une position stable tout au long de l'exercice."",""Ramenez doucement les dumbbells vers votre front en gardant les coudes légèrement fléchis."",""Répétez pour un total de 10 à 15 répétitions.""],""breathing"":[""Respirez profondément et lissez votre respiration tout au long de l'exercice."",""Inspirez lors de la phase de descente et expirez lors de la phase de poussée.""],""common_mistakes"":[""Ne plissez pas vos épaules vers votre oreille."",""Ne laissez pas vos coudes fléchir trop au-dessus de votre tête."",""Ne vous penchez pas en avant ou en arrière pendant l'exercice.""]}",dumbbell,Triceps
af2cc5d5-b63d-44dc-aedc-366b6733873a,Incliner pousser vers le haut,Incline Push up,Pectoraux,"{""setup"":[""Commencez en position de poussée avec les mains légèrement plus larges que l'épaule"",""Les pieds sont à mi-hauteur, les fesses et le dos en ligne droite"",""Les bras sont parallèles au sol, les coudes légèrement en dedans"",""Regardez vers le sol pour maintenir la ligne droite du dos""],""movement"":[""Descendez en gardant les coudes légèrement en dedans"",""Descendez jusqu'à ce que votre torse soit à environ 15 cm du sol"",""Poussez-vous vers le haut en contractant les pectoraux"",""Revenez à la position de départ""],""breathing"":[""Respirez profondément pendant la descente"",""Exhale pendant la poussée vers le haut""],""common_mistakes"":[""Ne pas maintenir la ligne droite du dos"",""Descendre trop bas ou trop haut"",""Utiliser les hanches pour aider à la poussée"",""Les coudes s'écartent trop des côtés""]}",bodyweight,Ischios
4454e6f0-7175-45b6-a013-18d170a3338b,Isométrie traction horizontale,Horizontal traction isometry,Dos,"{""setup"":[""Assis sur le sol avec les jambes étendues et les mains derrière vous."",""Placez vos mains à plat sur le sol, légèrement plus large que votre largeur d'épaules."",""Appuyez sur vos mains et tirez votre corps vers le haut, formant un angle de 45 degrés avec le sol."",""Assurez-vous que votre dos est plat et que votre corps forme une ligne droite.""],""movement"":[""Maintenez cette position pendant 30 secondes à 1 minute."",""Respirez calmement tout au long de l'exercice."",""Ne bougez pas pendant l'exercice, maintenez une position stable."",""Si vous ressentez de la douleur, arrêtez l'exercice.""],""breathing"":[""Respirez calmement tout au long de l'exercice."",""Inspirez pendant la phase de contraction et expirez pendant la phase de relâchement.""],""common_mistakes"":[""Ne pas maintenir une position droite, ce qui peut entraîner une compression du dos."",""Utiliser les jambes pour soutenir le corps, ce qui peut entraîner une mauvaise posture."",""Respirer de manière incorrecte, ce qui peut affecter la contraction musculaire."",""Tenter de tenir trop longtemps, ce qui peut entraîner une fatigue excessive.""]}",bodyweight,Épaules; Biceps
61d6da8b-fd59-4421-a88b-5c343b3ec848,Jeté force,Push Press,Trapèzes,"{""setup"":[""Prenez une position debout avec les pieds écartés à la largeur des épaules"",""Tenir le corps droit et les épaules en arrière"",""Prendre le poids du corps avec les mains en position de press"",""Placer les pieds sous les barres imaginaires""],""movement"":[""Commencez par un mouvement de genoux pour lever le poids"",""Pendant ce mouvement, ramenez les épaules en arrière"",""À la fin de la phase de genoux, propulsez le poids vers le haut"",""Lors de la phase finale, concentrez-vous sur le mouvement des épaules""],""breathing"":[""Respirez profondément avant de commencer le mouvement"",""Exhale pendant la phase de genoux et de propulsion"",""Inspirez pendant la phase de descente""],""common_mistakes"":[""Ne pas utiliser les genoux pour lever le poids"",""Ne pas propulser suffisamment avec les épaules"",""Respirer incorrectement, ce qui peut affecter la performance""]}",bodyweight,Fessiers
bb4cb07b-6239-420a-a4dc-08dc077b9f3c,Jeté olympique,Jerk OL,Épaules,"{""setup"":[""Prenez position debout avec les pieds largement écartés, les orteils légèrement tournés vers l'avant."",""Prenez le barbell avec les mains largement écartées, les avant-bras parallèles au sol."",""Pliez les genoux légèrement et maintenez un dos droit."",""Placez le barbell juste au-dessus des cuisses, en gardant le tronc droit.""],""movement"":[""Poussez le barbell vers le haut en utilisant principalement les épaules et les jambes."",""Lorsque le barbell atteint la hauteur de vos épaules, poussez-le vers le haut en utilisant les épaules."",""Conservez le tronc droit et ne pivotez pas les hanches."",""Lorsque le barbell est au-dessus de la tête, maintenez-le quelques secondes.""],""breathing"":[""Respirez profondément avant de commencer l'exercice."",""Exhalez lentement lorsque vous poussez le barbell vers le haut.""],""common_mistakes"":[""Ne pivotez pas les hanches vers l'avant."",""Ne plissez pas les épaules vers l'avant."",""Ne pliez pas trop les genoux au début de l'exercice."",""Ne laissez pas le barbell toucher votre tête.""]}",barbell,Fessiers; Quadriceps; Triceps
de4d55da-306c-4f9a-932d-b657a3c73772,Jumping jack HD,Jumping Jack HD,Quadriceps,"{""setup"":[""Commencez en position debout avec les pieds ensemble et les bras le long du corps."",""Assurez-vous que votre pied est bien planté et que votre alignement est correct."",""Respirez naturellement et restez détendu.""],""movement"":[""Poussez les bras vers le haut tout en sautant pour élargir les jambes."",""Les jambes doivent être écartées à environ la largeur des épaules."",""Revenez à la position initiale en sautant et en ramenant les bras le long du corps."",""Répétez l'exercice en gardant le rythme et en restant en contrôle.""],""breathing"":[""Respirez naturellement tout au long de l'exercice."",""Inspirez lors de l'écartement des jambes et des bras."",""Exhalez lors du retour à la position initiale.""],""common_mistakes"":[""Ne pas maintenir l'alignement du corps."",""Sauter trop haut et perdre le contrôle de l'exercice."",""Ne pas élargir suffisamment les jambes."",""Respirer de manière incorrecte, ce qui peut entraîner une respiration sifflante.""]}",bodyweight,Fessiers; Abdos; Abdos
683eb5fc-f59d-448d-a7f6-77ecfa5e6f97,Jumping jacks,Jumping Jacks,Quadriceps,"{""setup"":[""Commencez en position debout avec les pieds ensemble et les bras le long du corps."",""Assurez-vous que votre pied est bien planté et que votre alignement est correct.""],""movement"":[""Écartez les jambes en faisant des sauts tout en levant les bras au-dessus de la tête."",""Revenez à la position initiale en sautant et en ramenant les bras le long du corps."",""Concentrez-vous sur le mouvement fluide et la coordination des jambes et des bras.""],""breathing"":[""Respirez naturellement en alternant l'expiration lors de l'écartement des jambes et de l'inspiration lors du retour à la position initiale.""],""common_mistakes"":[""Ne pas maintenir une position de tronc droit et de hanches."",""Sauter trop haut, ce qui peut entraîner une mauvaise technique et une surutilisation des genoux."",""Ne pas synchroniser correctement le mouvement des jambes et des bras.""]}",bodyweight,
