id,name,name_en,muscle_group,instructions,equipment,secondary_muscles
91522c8a-1101-43b3-8081-e436dbd60c69,Rotation ballon lesté,Medicine ball twist,Abdos,"{""setup"":[""Placez-vous en position debout avec les pieds écartés."",""Hissez le ballon lesté vers le haut, près de votre poitrine."",""Assurez-vous que votre dos est droit et que votre corps est stable.""],""movement"":[""Tournez votre tronc vers la droite en maintenant le ballon lesté."",""Revenez à la position centrale et tournez ensuite vers la gauche."",""Répétez ces mouvements en alternant les côtés."",""Concentrez-vous sur le mouvement du tronc et évitez de pivoter sur les hanches.""],""breathing"":[""Respirez profondément et régulièrement tout au long de l'exercice."",""Inspirez lors de la rotation vers la droite et expirez lors de la rotation vers la gauche.""],""common_mistakes"":[""Ne pivotez pas sur les hanches, mais concentrez-vous sur le mouvement du tronc."",""Assurez-vous de maintenir le ballon lesté près de votre poitrine pour une meilleure stabilité."",""Evitez de faire des mouvements trop rapides qui pourraient entraîner une mauvaise posture.""]}",other,
930c25f9-d290-4f76-bbeb-318f3dce54ab,Rotation du tronc,Core Rotation,Quadriceps,"{""setup"":[""Débutez à genoux avec les mains posées sur les hanches"",""Gardez le dos droit et engagez vos abdominaux"",""Faites face à l'avant""],""movement"":[""Faites pivoter votre tronc vers la gauche en gardant les hanches fixes"",""Répétez le mouvement vers la droite"",""Alternez les côtés en répétant le mouvement""],""breathing"":[""Respirez naturellement en inspirant lors de la phase de préparation"",""Expirez doucement lors de la rotation""],""common_mistakes"":[""Ne penchez pas en avant ou en arrière"",""Gardez les genoux légèrement pliés pour maintenir l'équilibre"",""Évitez de forcer les mouvements""]}",bodyweight,Abdos; Abdos
4d4e1b96-8a72-4bfd-9811-cc1eccf6cfe5,Rotation du tronc poulie,Trunk Rotation With Cable,Abdos,"{""setup"":[""Placez-vous devant la poulie, pieds écartés."",""Tournez-vous vers la poulie, main droite sur la poignée."",""Gardez le dos droit et les hanches immobiles."",""Assurez-vous que votre pied opposé est bien ancré au sol.""],""movement"":[""Pousser doucement la poignée vers le côté opposé de votre corps."",""Retournez lentement à la position initiale."",""Répétez l'exercice en alternant les mains."",""Concentrez-vous sur le mouvement du tronc.""],""breathing"":[""Respirez profondément pendant le mouvement de poussée."",""Exhale lentement pendant le retour à la position initiale.""],""common_mistakes"":[""Ne pas garder les hanches immobiles."",""Utiliser les bras pour faire la majorité du travail."",""Ne pas maintenir une position de tronc droit.""]}",bodyweight,Dos
681a4606-be56-4249-842d-ed305bb4590a,Rotation externe épaule haltère,Shoulder External Rotation with Dumbbell,Épaules,"{""setup"":[""Placez-vous face à un banc ou une chaise."",""Saisissez le haltère avec votre main droite et placez votre genou droit sur le banc."",""Votre bras droit doit être tendu vers le haut, parallèle au sol."",""Gardez votre corps stable et votre dos droit.""],""movement"":[""Pivotez votre coude vers l'extérieur en gardant le bras tendu."",""Concentrez-vous sur le mouvement de votre épaule et de votre coude."",""Revenez lentement à la position initiale."",""Répétez l'exercice avec votre bras gauche.""],""breathing"":[""Respirez naturellement tout au long de l'exercice."",""Ne retenez pas votre respiration.""],""common_mistakes"":[""Ne pas maintenir le bras tendu tout au long du mouvement."",""Utiliser un poids trop lourd, ce qui peut entraîner des blessures."",""Ne pas se concentrer sur le mouvement de l'épaule et du coude.""]}",dumbbell,Trapèzes
31419c2c-8e7a-4a8c-90d7-4ee7b14a57a5,Rotation externe épaule poulie,Shoulder External Rotation (Cable),Épaules,"{""setup"":[""Placez-vous face à la poulie, tenez-la à la main avec le bras tendu."",""Plantez les pieds fermement au sol, maintenez une posture droite."",""Gardez le coude de l'autre bras contre le côté du corps."",""Assurez-vous que la poulie est à hauteur du coude.""],""movement"":[""Concentrez-vous sur le mouvement de rotation externe de l'épaule."",""Conservez le coude fixe et faites pivoter le poignet vers l'extérieur."",""Poussez doucement la manche de la poulie vers l'extérieur."",""Rappelez-vous de ne pas utiliser le tronc pour aider le mouvement.""],""breathing"":[""Respirez naturellement tout au long de l'exercice."",""Inspirez lors de la phase de retour vers le départ."",""Exhalez lors de la phase de contraction.""],""common_mistakes"":[""Ne pas maintenir une posture droite."",""Utiliser le tronc pour aider le mouvement."",""Ne pas garder le coude fixe."",""Faire des mouvements brusques ou de trop grande amplitude.""]}",bodyweight,
4fa26d83-bc91-4a86-9047-ffb476ce0f05,Rotation externe poulie,Cable External Rotation,Épaules,"{""setup"":[""Prenez la poulie à hauteur de l'épaule avec la main supérieure."",""Placez-vous face à la poulie, pieds écartés pour une bonne stabilité."",""Gardez le dos droit et la tête droite."",""Faites face à la poulie avec le bras inférieur à la hanche.""],""movement"":[""Poussez doucement le manche vers le haut avec le bras supérieur."",""Conservez le coude fixe et le bras inférieur immobile."",""Retournez lentement au départ."",""Répétez pour un total de 10 à 15 répétitions.""],""breathing"":[""Respirez profondément et lissez votre respiration."",""Inspirez lors de la phase de retour."",""Exhalez lors de la phase de poussée.""],""common_mistakes"":[""Ne pliez pas le coude ou le bras inférieur."",""Ne pivotez pas le corps."",""Ne faites pas d'excès de mouvement avec le bras inférieur."",""Assurez-vous de maintenir une bonne posture tout au long de l'exercice.""]}",bodyweight,
0a94032d-fc3a-45fd-bac6-6f80c0ce1f60,Rotation interne allongé latéral,Side-laying interior rotation,Trapèzes,"{""setup"":[""Allongez-vous sur le côté droit, le genou droit au-dessus du genou gauche."",""Placez votre bras droit sous votre tête, le bras gauche est étendu vers le haut."",""Soutenez-vous avec le pied droit et le bras gauche."",""Assurez-vous que votre corps est bien aligné et que votre tête est dans une ligne droite avec votre dos.""],""movement"":[""Prennez le barbell du côté de votre main gauche."",""Faites une rotation interne de votre bras gauche en gardant le coude droit fixe."",""Concentrez-vous sur le mouvement des trapèzes et évitez de bouger le coude."",""Rappelez-vous de faire le mouvement lentement et contrôlé.""],""breathing"":[""Respirez profondément et lissez votre respiration tout au long de l'exercice."",""Inspirez lors de la phase de descente et expirez lors de la phase de poussée.""],""common_mistakes"":[""Ne pas maintenir une position stable du corps."",""Bouger le coude au lieu de faire la rotation interne."",""Ne pas contrôler le mouvement, ce qui peut entraîner une mauvaise technique.""]}",barbell,
6f65989a-a4d9-42d1-9d50-e2949ffa39b5,Rotation interne épaule poulie,Shoulder Internal Rotation (Cable),Épaules,"{""setup"":[""Placez-vous face à la poulie, tenez le manche à deux mains."",""Plantez les pieds fermement au sol, écartez-les légèrement."",""Tournez légèrement le corps de manière à ce que l'épaule à travailler soit face à la poulie."",""Gardez le dos droit et la tête droite.""],""movement"":[""Commencez avec le bras non dominant parallèle au sol."",""Pousser doucement le manche vers le bas en faisant tourner l'épaule vers l'intérieur."",""Retournez lentement au départ sans utiliser la force du cou."",""Répétez pour l'autre bras.""],""breathing"":[""Respirez naturellement tout au long de l'exercice."",""Ne retenez pas votre respiration.""],""common_mistakes"":[""Ne pas utiliser le cou pour retourner le manche."",""Faire l'exercice avec un poids trop lourd."",""Ne pas maintenir une position de corps correcte.""]}",bodyweight,
4dfbccd4-0a00-4c20-bd71-75339c04d677,Rotation russe,Russian Twist,Dos,"{""setup"":[""Assis sur le sol avec les jambes croisées et les pieds au sol."",""Tenir un dumbbell avec les deux mains devant le torse."",""S'assurer que le dos est droit et que la tête est alignée avec le reste du corps.""],""movement"":[""Pivoter lentement le corps vers la droite, en maintenant le dumbbell."",""Revenir lentement au centre et pivoter vers la gauche."",""Continuer à pivoter de droite à gauche, en maintenant le dumbbell."",""Concentrer l'effort sur le dos et les obliques.""],""breathing"":[""Respirer naturellement tout au long de l'exercice."",""Ne retenez pas votre respiration.""],""common_mistakes"":[""Ne pas maintenir le dos droit."",""Utiliser les hanches au lieu des obliques pour pivoter."",""Ne pas contrôler le mouvement.""]}",dumbbell,
7b53866b-31e9-4a84-a452-4c8a20387c2d,Rotations épaules haltères,Dumbbell Shoulder Rotations,Épaules,"{""setup"":[""Placez-vous debout avec les pieds écartés, les genoux légèrement fléchis."",""Halteres tenus à la hauteur de la hanche, main droite tenant le poids droit."",""Gardez le dos droit et la tête droite."",""Assurez-vous que vos épaules sont détendues.""],""movement"":[""Commencez par faire pivoter le poids vers l'extérieur, en tournant le bras et l'épaule."",""Continuez le mouvement en faisant pivoter le poids vers l'intérieur."",""Effectuez 10 rotations dans chaque direction."",""Assurez-vous de maintenir le contrôle tout au long du mouvement.""],""breathing"":[""Respirez naturellement tout au long de l'exercice."",""Ne retenez pas votre respiration.""],""common_mistakes"":[""Ne pivotez pas uniquement le cou pour faire le mouvement."",""Assurez-vous de ne pas utiliser votre dos pour effectuer le mouvement."",""Ne faites pas de mouvements brusques ou saccadés.""]}",dumbbell,
6c3d4245-cec8-4959-962a-4e5fa70fca65,Roue abdominale,Ab wheel,Abdos,"{""setup"":[""Commencez en position assise avec les pieds posés au sol."",""Prenez la roue abdominale avec les mains et placez-la sous votre torse."",""Placez vos pieds sur le sol, écartés à la largeur des hanches."",""Gardez vos bras droits et vos épaules alignées avec vos mains.""],""movement"":[""Poussez avec vos pieds pour vous redresser en tenant la roue."",""Maintenez une position de ligne droite de la tête aux pieds."",""Poussez jusqu'à ce que vos jambes soient parallèles au sol."",""Ralentissez le mouvement en revenant lentement au sol.""],""breathing"":[""Respirez profondément pendant le redressement."",""Exhale lentement en revenant au sol.""],""common_mistakes"":[""Ne pas maintenir une position de ligne droite."",""Utiliser les bras pour soutenir le poids au lieu de l'utiliser pour se redresser."",""Ne pas contrôler le mouvement en revenant lentement au sol.""]}",bodyweight,Abdos; Abdos
a490fd60-69a9-4710-9a81-2af3a4a0df12,Roue jambes,Leg Wheel,Abdos,"{""setup"":[""Assis par terre avec les jambes étendues devant vous."",""Placez vos mains derrière vous pour vous appuyer."",""Gardez vos genoux droits et vos pieds pointés."",""Faites face au sol avec vos yeux.""],""movement"":[""Poussez avec vos mains pour lever votre corps."",""Gardez votre dos droit et vos jambes étendues."",""Poussez vos hanches vers le haut en formant un arc."",""Ralentissez et contrôlez le mouvement en redescendant.""],""breathing"":[""Respirez profondément en poussant."",""Exhale lentement en redescendant."",""Gardez votre respiration calme tout au long de l'exercice.""],""common_mistakes"":[""Ne pas garder les jambes étendues."",""Faire courber le dos."",""Utiliser les bras pour soutenir tout le poids du corps."",""Descendre trop rapidement.""]}",bodyweight,
7c253592-fe25-4bc4-bed9-73fbb920b8a6,Rouleau de massage mollets,Calves foam roller,Mollets,"{""setup"":[""Assis sur le sol avec le rouleau de massage sous les mollets."",""Les jambes étirées, les genoux droits ou légèrement pliés selon la préférence."",""Poser les mains sur le sol pour soutenir le corps."",""Respirer normalement tout au long de l'exercice.""],""movement"":[""Appuyer doucement sur le rouleau en le déplaçant de haut en bas des mollets."",""S'arrêter sur les zones douloureuses pour 10 à 30 secondes."",""Faire plusieurs passes sur chaque mollet.""],""breathing"":[""Respirez profondément et régulièrement."",""Ne retenez pas votre respiration.""],""common_mistakes"":[""Ne pas appuyer suffisamment sur le rouleau."",""Se déplacer trop rapidement sur le rouleau."",""Ne pas s'arrêter sur les zones douloureuses.""]}",bodyweight,
d7136662-8e24-4d6a-b7c2-5997c9c5cc18,Rouleau de mousse gluteus,Foam Roller Gluteus,Fessiers,"{""setup"":[""Assis sur le rouleau de mousse, placez vos fessiers dessus."",""Placez vos mains derrière vous pour soutenir votre dos."",""Étirez bien vos jambes devant vous, les genoux légèrement fléchis."",""Commencez par le haut des fessiers.""],""movement"":[""Appuyez sur le rouleau en vous appuyant sur vos mains."",""Déplacez le rouleau lentement de haut en bas des fessiers."",""Sentez où il y a le plus de tension et y restez quelques secondes."",""Faites de 2 à 3 passes sur chaque section.""],""breathing"":[""Respirez profondément tout au long de l'exercice."",""Inspirez lors de la descente du rouleau et expirez lors de l'ascension."",""Respirez naturellement et ne retenez pas votre respiration.""],""common_mistakes"":[""Ne pas appuyer suffisamment sur le rouleau."",""Se déplacer trop rapidement le rouleau."",""Respirer de manière incorrecte, retenir sa respiration."",""Ne pas s'arrêter sur les zones de tension.""]}",bodyweight,
9ce5f82a-3feb-4e72-ab70-fb54440b7def,Rouleau en mousse bande iliotibiale,Foam Roller Iliotibial band,Quadriceps,"{""setup"":[""Assis sur le rouleau en mousse, placez votre genou droit dessus."",""Plantez votre pied gauche sur le sol pour stabiliser votre corps."",""Appuyez sur le rouleau avec votre genou droit."",""Gardez votre dos droit et votre tête alignée avec votre colonne vertébrale.""],""movement"":[""Appuyez doucement sur le rouleau en mousse en glissant de haut en bas."",""Concentrez-vous sur les zones douloureuses ou tendues."",""Gardez votre respiration naturelle tout au long de l'exercice.""],""breathing"":[""Respirez naturellement tout au long de l'exercice."",""Ne retenez pas votre respiration.""],""common_mistakes"":[""Ne pas maintenir une respiration naturelle."",""Appuyer trop fort sur le rouleau en mousse."",""Ne pas glisser le rouleau en mousse de haut en bas.""]}",bodyweight,
eded734c-41b4-4e81-ad16-3a6a56b33c75,Rowing,Row,Dos,"{""setup"":[""Prenez une position assise avec les jambes étirées devant vous."",""Placez vos pieds sur les manettes de l'ergomètre."",""Tenir fermement le bar avec vos mains."",""Assurez-vous que votre dos est droit et que votre tête est alignée avec votre colonne vertébrale.""],""movement"":[""Poussez vos pieds contre les manettes pour vous lever."",""Poussez votre bassin en arrière tout en inclinant votre tronc."",""Poussez le bar vers vous en tirant avec vos bras."",""Ramenez votre corps vers l'avant en exhalant."",""Relâchez le bar et répétez l'exercice.""],""breathing"":[""Inspirez profondément lorsque vous vous penchez en arrière."",""Exhale lorsque vous vous redressez et poussez le bar."",""Maintenez une respiration régulière tout au long de l'exercice.""],""common_mistakes"":[""Ne pas maintenir une position de dos droit."",""Utiliser les bras uniquement pour pousser le bar."",""Ne pas utiliser la force de vos jambes pour se lever."",""Respirer de manière incorrecte, ce qui peut entraîner une fatigue prématurée.""]}",barbell,Quadriceps
78045070-8519-401e-a43f-004e8bce777a,Rowing allongé sur banc,"Rowing, Lying on Bench",Dos,"{""setup"":[""Allongez-vous sur le banc avec vos pieds solidement plantés au sol."",""Placez vos mains derrière votre tête ou sur votre torse pour soutenir votre dos."",""Assurez-vous que votre dos est bien appuyé sur le banc."",""Relaxez vos jambes et vos bras.""],""movement"":[""Poussez avec vos jambes pour lever votre corps."",""Pendant que vous levez votre corps, ramenez vos genoux vers votre poitrine."",""Poussez vos hanches vers le haut en gardant votre dos droit."",""Rappelez-vous de ne pas soulever votre tête et de garder votre cou relaxé.""],""breathing"":[""Respirez profondément et lissez votre respiration tout au long de l'exercice."",""Respirez pendant que vous poussez avec vos jambes et expirez pendant que vous ramenez vos genoux vers votre poitrine.""],""common_mistakes"":[""Ne poussez pas avec vos bras, utilisez plutôt vos jambes et votre dos."",""Assurez-vous de ne pas soulever votre tête, ce qui peut endommager votre dos."",""Gardez votre dos droit et ne le laissez pas s'incurver."",""Ne faites pas d'excès de mouvement avec vos hanches, restez centré sur le mouvement des jambes et du dos.""]}",bodyweight,
b4d1212d-f5b4-4b80-acc0-fcb229ee3ae7,Rowing assis machine,Seated Row (Machine),Dos,"{""setup"":[""Assis sur la machine, placez vos pieds fermement dans les étriers."",""Saisissez la manche avec vos mains écartées."",""Gardez votre dos droit et votre tête alignée avec votre colonne vertébrale."",""Appuyez sur vos orteils pour vous redresser légèrement.""],""movement"":[""Poussez doucement la manche vers vous, en tirant avec vos épaules et vos bras."",""Conservez votre dos droit tout au long de l'exercice."",""Revenez lentement à la position initiale."",""Répétez l'exercice.""],""breathing"":[""Respirez profondément pendant la phase de poussée."",""Exhale lentement pendant la phase de retour.""],""common_mistakes"":[""Ne plissez pas votre dos pendant l'exercice."",""Ne faites pas usage de vos jambes pour aider à la poussée."",""Assurez-vous de maintenir une position de dos droit.""]}",bodyweight,Épaules; Trapèzes
21c213e6-3896-4dad-986c-50a99d830b48,Rowing barre pronation,Barbell Row (Overhand),Dos,"{""setup"":[""Prenez la barre avec les mains en position pronation, épaules larges."",""Placez-vous avec les pieds à épaules larges, dos droit."",""Descendez la barre en gardant les genoux légèrement fléchis."",""Assurez-vous que votre corps forme un angle droit avec les jambes.""],""movement"":[""Lever la barre vers le haut en soulevant vos épaules vers vos oreilles."",""Concentrez-vous sur l'extension des épaules et des trapèzes."",""Descendez lentement la barre en contrôlant le mouvement."",""Ne permettez pas vos hanches de se lever au sommet de la rétention.""],""breathing"":[""Respirez profondément pendant la descente."",""Exhale pendant la phase de levée de la barre.""],""common_mistakes"":[""Ne pas maintenir une position de dos droit."",""Utiliser le mouvement des hanches au lieu des muscles du dos."",""Ne pas contrôler la descente de la barre.""]}",barbell,
32130b7a-ee6e-483a-abe3-faf94f839c8c,Rowing barre supination,Barbell Row (Underhand),Dos,"{""setup"":[""Prenez la barre avec les mains en position supinée, les doigts vers le bas."",""Placez-vous face au banc avec les pieds largement écartés."",""Gardez le dos droit et les genoux légèrement fléchis."",""Saisissez la barre avec une prise large.""],""movement"":[""Descendez la barre vers vos côtes en gardant le dos droit."",""Poussez la barre vers le haut en soulevant vos épaules vers vos côtes."",""Concentrez-vous sur l'extension des épaules et des bras."",""Rappelez-vous de ne pas utiliser votre dos pour soulever la barre.""],""breathing"":[""Respirez profondément pendant la descente."",""Exhale lentement pendant la poussée.""],""common_mistakes"":[""Ne pas maintenir le dos droit pendant l'exécution de l'exercice."",""Utiliser le dos pour soulever la barre au lieu des épaules et des bras."",""Ne pas contrôler la descente de la barre.""]}",barbell,
ef8d38b9-3801-42f8-ac6a-e611dfcf5205,Rowing deltoïde postérieur haltère,Dumbbell rear delt row,Épaules,"{""setup"":[""Assis sur une chaise avec les pieds solidement posés au sol"",""Tenir un haltère avec les deux mains, bras tendus vers le bas"",""S'assurer que le dos est droit et que la tête est alignée avec le corps""],""movement"":[""Pulser en tirant l'haltère vers les côtes tout en gardant les bras parallèles à la colonne vertébrale"",""Concentrer l'effort sur les épaules postérieures tout en évitant de lever le tronc"",""Relâcher doucement l'haltère en gardant les bras tendus vers le bas""],""breathing"":[""Respirer normalement tout au long de l'exercice"",""Ne retenez pas votre respiration""],""common_mistakes"":[""Ne pas maintenir une position de dos droit"",""Utiliser le tronc pour aider à lever l'haltère au lieu de se concentrer sur les épaules"",""Ne pas contrôler le mouvement en descendant l'haltère""]}",dumbbell,
6f85796c-ac88-46c6-bc96-9c8bde958ec7,Rowing gorilla alterné haltères,Alternative DB Gorilla rows,Dos,"{""setup"":[""Prenez un haltère dans chaque main, bras tendus vers le sol."",""Placez-vous face à un banc ou une table stable."",""Saisissez le bord du banc ou de la table avec vos mains."",""Assurez-vous que vos pieds sont bien ancrés au sol.""],""movement"":[""Poussez-vous du sol pour vous lever, tout en gardant vos bras tendus."",""Pendant que vous vous redressez, ramenez un haltère vers vos côtes avec votre main opposée."",""Puis, ramenez l'autre haltère vers vos côtes avec votre main opposée."",""Répétez l'exercice en alternant les côtés.""],""breathing"":[""Respirez profondément et lâchez lentement l'air pendant la phase de ramassage de l'haltère."",""Respirez pendant la phase de redressement.""],""common_mistakes"":[""Ne pas maintenir une position de redressement correcte."",""Utiliser le mouvement du tronc au lieu de celui des épaules et du dos."",""Ne pas contrôler le mouvement en descendant.""]}",dumbbell,
3bfd60f4-1d5e-4f4a-ab0b-aa35452aca08,Rowing haltère sur banc incliné,Incline Chest-Supported Dumbbell Row,Biceps,"{""setup"":[""Placez-vous sur le banc incliné avec les pieds solides et les genoux légèrement fléchis."",""Prenez un haltère dans chaque main, les bras tendus vers le haut."",""Assurez-vous que votre dos est bien droit et que votre tête est alignée avec votre colonne vertébrale."",""Soutenez votre poids avec vos jambes et vos bras, sans utiliser votre dos pour le faire.""],""movement"":[""Pendant la phase de descente, penchez-vous légèrement en arrière tout en gardant le dos droit."",""Pendant la phase de remontée, concentrez-vous sur l'extension des bras et la contraction des biceps."",""Assurez-vous de contrôler le mouvement tout au long de la répétition."",""Ne pliez pas le dos ou les genoux pendant le mouvement.""],""breathing"":[""Respirez profondément et lissez votre respiration tout au long du mouvement."",""Inspirez pendant la phase de descente et expirez pendant la phase de remontée.""],""common_mistakes"":[""Ne pliez pas le dos ou les genoux pendant le mouvement."",""Ne faites pas usage de votre dos pour soulever le poids."",""Assurez-vous de contrôler le mouvement pour éviter les blessures."",""Ne faites pas de mouvements brusques ou saccadés.""]}",bench,
01d735cf-50ac-413e-b0ec-ab8954a9b71e,Rowing haltères allongé SS shrugs assis,LYING DUMBBELL ROW SS SEATED SHRUG,Dos,"{""setup"":[""Allongez-vous sur le banc avec vos pieds solidement ancrés."",""Prenez un haltère dans chaque main, bras tendus vers le plafond."",""Gardez votre dos plat et votre tête alignée avec votre colonne vertébrale."",""Assurez-vous que vos hanches et vos genoux sont légèrement fléchis.""],""movement"":[""Poussez vos hanches vers le plafond tout en tirant l'haltère vers votre sternum."",""Concentrez-vous sur l'extension de vos épaules et de vos dos."",""Retournez à la position initiale en contrôlant le mouvement."",""Répétez pour les deux bras simultanément.""],""breathing"":[""Respirez profondément et lissez votre respiration tout au long du mouvement."",""Inspirez lors de la phase de descente et expirez lors de la phase de poussée.""],""common_mistakes"":[""Ne pliez pas votre dos ou votre tête pendant l'exercice."",""Ne poussez pas vos hanches trop haut, ce qui pourrait entraîner une mauvaise posture."",""Assurez-vous de contrôler le mouvement pour éviter les mouvements brusques."",""Ne tirez pas trop fort sur l'haltère, ce qui pourrait entraîner une tension inutile.""]}",dumbbell,
01807007-7465-4a5f-8155-e0eff0dc10da,Rowing inversé,Inverted Rows,Biceps,"{""setup"":[""S'accroupir sous la barre avec les mains sur la barre"",""Saisir fermement la barre avec les mains écartées plus largement que les épaules"",""Placer les pieds contre un banc ou une chaise pour maintenir l'équilibre"",""Se tenir droit avec les bras tendus""],""movement"":[""Descendre lentement en gardant les bras tendus"",""Plier les bras pour ramener le torse vers la barre"",""Relever le corps en exerçant la force des biceps"",""Redescendre lentement pour terminer une répétition""],""breathing"":[""Respirer normalement tout au long de l'exercice"",""Ne retenez pas votre respiration""],""common_mistakes"":[""Ne pas maintenir les bras tendus pendant la descente"",""Utiliser les épaules au lieu des biceps pour soulever le corps"",""Ne pas contrôler la descente pour éviter les blessures""]}",bodyweight,Pectoraux; Abdos; Trapèzes
