id,name,name_en,muscle_group,instructions,equipment,secondary_muscles
19c42f40-a8df-4768-bb89-ff66c38eae54,○ étirement des muscles de la cuisse,Knee to Chest Stretch,Fessiers,"{""setup"":[""Assis sur le sol avec les jambes étendues."",""Placer les mains derrière vous pour vous appuyer si nécessaire."",""Respirez calmement et détendez-vous."",""Gardez la colonne vertébrale droite.""],""movement"":[""Ramenez une cuisse vers le torse en saisissant le genou avec la main."",""Poussez doucement le genou vers l'abdomen."",""Rester dans cette position pendant quelques secondes."",""Relâchez et répétez de l'autre côté.""],""breathing"":[""Respirez calmement tout au long de l'exercice."",""Inspirez lorsque vous vous étirez et expirez lors de la relaxation.""],""common_mistakes"":[""Ne pas maintenir une respiration régulière."",""Forcer trop fort ce qui peut causer des blessures."",""Ne pas garder le dos droit.""]}",bodyweight,Ischios
1499d592-dd22-48ed-9bc1-148aa85f30b4,Ab rollout barre,Barbell Ab Rollout,Abdos,"{""setup"":[""Placez-vous à genoux devant la barre avec vos mains sur elle."",""Écartez vos mains plus largement que vos épaules."",""Assurez-vous que vos pieds sont à plat et que votre corps est droit."",""Prenez la barre avec vos mains et déplacez-la vers vos pieds.""],""movement"":[""Commencez en position de départ, genoux pliés et pieds à plat."",""Poussez avec vos mains pour rouler la barre vers vos pieds."",""Continuez jusqu'à ce que votre corps soit à peu près parallèle au sol."",""Rappelez-vous de garder votre corps droit tout au long de l'exercice.""],""breathing"":[""Respirez profondément et lâchez votre souffle lentement tout au long de l'exercice.""],""common_mistakes"":[""Ne pliez pas les genoux trop bas, cela peut entraîner des blessures."",""Assurez-vous de ne pas laisser votre bassin s'abaisser vers le sol."",""Ne roulez pas trop loin avec la barre, cela peut entraîner une surcharge sur les épaules.""]}",barbell,
22dc0b25-faad-4d0d-9aa2-1bea583bd86a,Abduction hanches assis,Seated Hip Abduction,Fessiers,"{""setup"":[""Assis sur une chaise avec les jambes étendues devant vous."",""Plantez les pieds à plat et maintenez la colonne vertébrale droite."",""Placez les mains derrière vous pour stabiliser le tronc."",""Gardez le buste droit et les épaules baissées tout au long de l'exercice.""],""movement"":[""Lever lentement le genou droit vers le haut, tout en gardant le pied droit à plat."",""Rappelez-vous de ne pas lever trop haut pour éviter les mouvements de rotation."",""Rappelez-vous de ne pas utiliser les bras pour aider à lever la jambe."",""Rappelez-vous de ne pas tirer la hanche vers le haut.""],""breathing"":[""Respirez naturellement tout au long de l'exercice."",""Inspirez lors de la phase de descente et expirez lors de la phase de levée.""],""common_mistakes"":[""Ne pas maintenir la colonne vertébrale droite."",""Utiliser les bras pour aider à lever la jambe."",""Tirer la hanche vers le haut."",""Lever la jambe trop haut, ce qui peut entraîner des mouvements de rotation.""]}",bodyweight,
bb3be6e0-0850-4612-ae6a-a2ff9f9bd11e,Abduction hanches machine,Machine Hip Abduction,Fessiers,"{""setup"":[""Assis sur la machine, placez vos hanches fermement contre le support."",""Placez vos pieds sur les barres de l'équipement."",""Gardez votre dos droit et votre tête alignée avec votre colonne vertébrale."",""Soyez sûr de ne pas utiliser vos mains pour vous soutenir.""],""movement"":[""Lever doucement vos jambes vers le haut, en gardant vos genoux droits."",""Retournez lentement vos jambes vers leur position initiale."",""Répétez l'exercice 10 à 15 fois pour un set.""],""breathing"":[""Respirez profondément et régulièrement tout au long de l'exercice."",""Exhale doucement lorsque vous levez vos jambes."",""Respirez naturellement lors du retour à la position initiale.""],""common_mistakes"":[""Ne pas maintenir une position stable et droite du corps."",""Utiliser les mains pour soutenir le corps."",""Ne pas maintenir les genoux droits pendant l'exercice."",""Faire des mouvements rapides et brusques au lieu de les effectuer lentement et contrôlés.""]}",bodyweight,
7eefe1b3-b826-422b-95ee-400ee2e9b14b,Abduction hanches supination,Supine Hip Abduction,Fessiers,"{""setup"":[""Allongez-vous sur le dos avec les genoux pliés et les pieds sur le sol."",""Placez un dumbbell entre vos chevilles, les bras tendus vers le plafond."",""Assurez-vous que votre dos est bien appuyé sur le sol."",""Pliez les hanches légèrement pour maintenir une courbe naturelle dans le dos.""],""movement"":[""Lever les jambes vers le plafond en gardant les genoux pliés."",""Concentrez-vous sur l'extension des fessiers."",""Retournez lentement les jambes vers le sol en contrôlant le mouvement."",""Répétez pour un total de 10 à 15 répétitions.""],""breathing"":[""Respirez profondément et lissez votre respiration tout au long du mouvement."",""Inspirez lorsque vous vous concentrez sur l'extension des fessiers."",""Exhalez lorsque vous retournez les jambes vers le sol.""],""common_mistakes"":[""Ne pliez pas les hanches ou le dos pendant le mouvement."",""Ne faites pas glisser les jambes sur le sol."",""Ne poussez pas trop fort avec les jambes pour lever les hanches."",""Assurez-vous que le dumbbell reste entre les chevilles tout au long du mouvement.""]}",dumbbell,
a734caec-afb3-4c27-b1b7-62e038a7d3d3,Adduction de Copenhague,Copenhagen Adduction Exercise,Fessiers,"{""setup"":[""Assis sur le banc, placez vos pieds à plat au sol, écartés à la largeur des hanches."",""Appuyez votre dos contre le banc et maintenez votre tête et votre dos alignés."",""Relâchez votre bassin et maintenez une position neutre de la colonne vertébrale."",""Placez vos mains derrière votre tête ou sur vos cuisses pour stabiliser votre tronc.""],""movement"":[""Poussez vos genoux vers l'avant en gardant vos hanches immobiles et vos pieds à plat."",""Continuez jusqu'à ce que vos genoux soient à environ 45 degrés par rapport au sol."",""Revenez lentement à la position initiale en contrôlant le mouvement."",""Répétez pour 10 à 15 répétitions.""],""breathing"":[""Respirez profondément et régulièrement tout au long de l'exercice."",""Inspirez lors de la phase de descente et expirez lors de la phase de poussée.""],""common_mistakes"":[""Ne permettez pas votre bassin de se lever ou de se pencher vers l'avant."",""Assurez-vous que vos genoux ne dépassent pas vos pieds."",""Ne roulez pas vos hanches vers l'extérieur."",""Concentrez-vous sur le contrôle de l'exercice plutôt que sur le nombre de répétitions.""]}",bench,Abdos; Abdos; Trapèzes
ec5fba82-052c-4146-8fff-875a0ccf4f58,Adduction hanches assis,Seated Hip Adduction,Fessiers,"{""setup"":[""Assis sur une chaise avec les pieds posés sur le sol."",""Les jambes sont écartées et les genoux sont légèrement fléchis."",""Les bras peuvent être posés sur les accoudoirs de la chaise ou sur les genoux."",""Le dos doit être droit et la tête droite.""],""movement"":[""Passez les pieds l'un vers l'autre en gardant les genoux fléchis."",""Revenez lentement à la position initiale."",""Répétez l'exercice plusieurs fois."",""Assurez-vous de contrôler le mouvement tout au long de l'exécution.""],""breathing"":[""Respirez naturellement tout au long de l'exercice."",""Ne retenez pas votre respiration."",""Respirez profondément et régulièrement.""],""common_mistakes"":[""Ne pas contrôler le mouvement, ce qui peut entraîner une mauvaise posture."",""Écartant trop les jambes, ce qui peut entraîner une surcharge des genoux."",""Ne pas garder les genoux fléchis, ce qui peut entraîner une mauvaise position des hanches."",""Faire l'exercice trop rapidement, ce qui peut entraîner une mauvaise technique.""]}",bodyweight,
1de2307f-dc6f-4d8e-bd41-3c7e2f98376d,Applaudissements au-dessus de la tête,Claps over the head,Épaules,"{""setup"":[""Placez-vous debout avec les pieds écartés à la largeur des épaules."",""Relaxez vos bras le long de votre corps."",""Assurez-vous que votre dos est droit et que votre tête est alignée avec votre colonne vertébrale."",""Faites face à un miroir si possible pour vérifier votre posture.""],""movement"":[""Lèvez vos bras au-dessus de votre tête en gardant vos coudes légèrement flexionnés."",""Appuyez sur vos pieds pour ajouter de la puissance à l'exercice."",""Faites un mouvement de va-et-vient en maintenant la position des bras."",""Rappelez-vous de ne pas plier les genoux ou de ne pas laisser vos coudes s'ouvrir.""],""breathing"":[""Respirez profondément et régulièrement tout au long de l'exercice."",""Inspirez lorsque vous commencez à lever vos bras et expirez lorsque vous les ramenez."",""Assurez-vous de ne pas retenir votre respiration.""],""common_mistakes"":[""Ne pas maintenir une bonne posture, ce qui peut entraîner des douleurs dans le dos."",""Plier les genoux, ce qui diminue l'efficacité de l'exercice et peut causer des blessures."",""Ouvrir les coudes, ce qui peut entraîner une tension supplémentaire dans les épaules."",""Ne pas utiliser la puissance des pieds, ce qui peut réduire l'efficacité de l'exercice.""]}",bodyweight,
c45bc861-6ea2-42de-968d-3f2ae3d0e38c,Arabesque,Arabesque,Ischios,"{""setup"":[""Placez-vous devant un miroir pour bien visualiser votre position."",""Écartez vos jambes d'environ 45 degrés."",""Pliez légèrement les genoux pour commencer."",""Gardez votre tronc droit et votre dos droit.""],""movement"":[""Lever la jambe arrière tout en gardant le genou droit."",""Pliez le genou de la jambe avant pour maintenir l'équilibre."",""Portez la jambe arrière au niveau de la hanche."",""Rappelez-vous de garder le dos droit tout au long de l'exercice.""],""breathing"":[""Respirez profondément et régulièrement tout au long de l'exercice."",""Inspirez lorsque vous commencez à lever la jambe arrière."",""Exhalez lorsque vous maintenez la jambe levée."",""Concentrez-vous sur votre respiration pour maintenir l'équilibre.""],""common_mistakes"":[""Ne pas garder le dos droit peut entraîner des douleurs lombaires."",""Plonger le genou de la jambe levée peut entraîner une blessure."",""Ne pas maintenir l'équilibre peut entraîner une chute."",""Ne pas respirer correctement peut entraîner une fatigue prématurée.""]}",bodyweight,
302e23fd-50cb-4719-aa20-370690de80c7,Arnold Press Haltères,Arnold Shoulder Press,Épaules,"{""setup"":[""Asseyez-vous sur un banc avec dossier, un haltère dans chaque main."",""Amenez les haltères au niveau des épaules, paumes vers vous."",""Gardez le dos droit et les pieds à plat au sol.""],""movement"":[""Poussez les haltères vers le haut en tournant les paumes vers l'avant."",""Tendez les bras au-dessus de la tête sans verrouiller les coudes."",""Redescendez en inversant la rotation jusqu'à la position initiale.""],""breathing"":[""Expirez en poussant les haltères vers le haut."",""Inspirez en redescendant à la position de départ.""],""common_mistakes"":[""Arquer excessivement le dos pendant la poussée."",""Utiliser un élan du corps pour monter les haltères."",""Négliger la rotation complète des poignets."",""Verrouiller les coudes en haut du mouvement.""]}",dumbbell,
5f7e9924-c05f-412e-be66-1d8b956f1a63,Arraché,Snach,Épaules,"{""setup"":[""Placez vos pieds à la largeur des épaules"",""Tenez la barbell avec une prise large"",""Gardez le dos droit et les épaules basses""],""movement"":[""Explosez vers le haut en étendant les jambes et les hanches"",""Faites passer la barbell le long de votre corps"",""Rattrapez la barbell au-dessus de votre tête en pliant les coudes""],""breathing"":[""Inspirez profondément avant de commencer le mouvement"",""Expirez en explosant vers le haut"",""Respirez normalement pendant la phase de récupération""],""common_mistakes"":[""Ne pas garder le dos droit"",""Faire passer la barbell trop loin de son corps"",""Ne pas exploser suffisamment vers le haut""]}",barbell,
56b1e5b5-5f67-4941-9538-40c5fa7fed89,Arraché olympique,Snatch OL,Épaules,"{""setup"":[""Prenez la barre avec vos mains écartées de manière confortable."",""Placez vos pieds largement, légèrement plus larges que votre épaule."",""Assurez-vous que votre pied droit est légèrement en avant."",""Regardez vers le point que vous visez à la hauteur de votre épaule.""],""movement"":[""Commencez par une pression puissante des pieds pour lever la barre."",""Lorsque la barre atteint la hauteur de vos genoux, commencez à la ramener vers vos épaules."",""Continuez à lever la barre en gardant votre corps stable et en tirant vers vous."",""Terminez en tenant la barre contre vos épaules avec vos bras tendus.""],""breathing"":[""Respirez profondément avant de commencer l'exercice."",""Maintenez une respiration régulière tout au long de l'exécution de l'exercice.""],""common_mistakes"":[""Ne pas utiliser la force des jambes au début de l'exercice."",""Ne pas maintenir une bonne posture tout au long de l'exécution."",""Tirer trop tôt avec les bras au lieu de laisser la barre monter naturellement.""]}",barbell,Dos
8eccdfcb-cb06-40e5-982e-a8eeb7d737b1,Aspiration abdominale,Abdominal Draw-In,Abdos,"{""setup"":[""Allongez-vous sur le dos avec les genoux pliés et les pieds à plat sur le sol"",""Placez les mains sous les hanches pour soutenir le bas du dos"",""Respirez normalement et détendez vos muscles""],""movement"":[""Inspirez profondément par le nez, puis expirez lentement par la bouche"",""Lors de l'expiration, tirez votre nombril vers votre colonne vertébrale"",""Maintenez la contraction pendant quelques secondes, puis relâchez""],""breathing"":[""Respirez naturellement et profondément pendant l'exercice"",""Évitez de retenir votre respiration, expirez lentement et contrôlément""],""common_mistakes"":[""Ne pas engager suffisamment les abdominaux"",""Retenir la respiration ou respirer de manière trop rapide"",""Ne pas maintenir la bonne position du dos""]}",bodyweight,
99dbafb5-0ef2-4771-942f-3839f62cfa51,Balancement jambes avant-arrière,Leg Swings (Front–Back),Ischios,"{""setup"":[""Placez-vous face à un support stable."",""Portez votre main droite sur votre hanche gauche et votre main gauche sur votre hanche droite."",""Écartez vos jambes légèrement pour maintenir votre équilibre.""],""movement"":[""Balayez vos jambes vers l'avant en gardant vos genoux droits."",""Puis balayez vos jambes vers l'arrière en gardant les genoux droits."",""Effectuez des mouvements lents et contrôlés."",""Répétez 10 fois avant de changer de jambe.""],""breathing"":[""Respirez naturellement tout au long de l'exercice."",""Ne retenez pas votre respiration.""],""common_mistakes"":[""Ne pas garder les genoux droits pendant les balancements."",""Faire des mouvements trop rapides et non contrôlés."",""Ne pas maintenir l'équilibre en posant les mains sur les hanches.""]}",bodyweight,Fessiers; Quadriceps
fe042277-ef07-406a-a5ec-978114eac800,Balancement jambes croisé,Crossbody Leg Swings,Ischios,"{""setup"":[""Prenez appui sur une barre ou un support stable."",""Pliez légèrement les genoux et gardez le dos droit."",""Portez l'une de vos jambes en avant, le pied vers le haut."",""Assurez-vous que votre corps est bien aligné.""],""movement"":[""Balayez votre jambe en avant et en arrière en gardant le mouvement fluide."",""Concentrez-vous sur le mouvement de la hanche et non sur la rotation du pied."",""Répétez le mouvement pour l'autre jambe."",""Faites 10 à 15 répétitions pour chaque jambe.""],""breathing"":[""Respirez naturellement en synchronisant votre respiration avec le mouvement."",""Inspirez en commençant le mouvement et expirez en terminant le mouvement.""],""common_mistakes"":[""Ne pas maintenir le dos droit et la colonne vertébrale bien alignée."",""Utiliser les bras pour aider à maintenir l'équilibre au lieu de se reposer sur un support stable."",""Faire des mouvements brusques ou saccadés au lieu de les garder fluides."",""Oublier de faire des répétitions équilibrées pour chaque jambe.""]}",bodyweight,
1a842bf1-6b3b-4efc-99ed-398de30905ab,Ball slams,Ball Slams,Dos,"{""setup"":[""Prenez une balle de basketball ou une balle de yoga."",""Placez-vous en position debout, pieds écartés, balle à hauteur de poitrine."",""Assurez-vous que votre dos est droit et vos épaules sont baissées.""],""movement"":[""Pliez les genoux légèrement et poussez la balle vers le sol en arrière de vous."",""Lorsque la balle atteint le sol, poussez-la aussi fort que possible vers le plafond."",""Répétez l'action en gardant le contrôle tout au long du mouvement.""],""breathing"":[""Respirez profondément pendant la phase de descente."",""Exhale bruyamment lorsque vous propulsez la balle vers le plafond.""],""common_mistakes"":[""Ne pas utiliser la force des jambes pour propulser la balle."",""Ne pas maintenir une position de dos droit tout au long de l'exercice."",""Respirer de manière incorrecte, ce qui peut réduire l'efficacité de l'exercice.""]}",bodyweight,Épaules; Fessiers
3f559914-6b72-4b42-a146-567dbfba879b,Bande d'exercice dorsiflexion,Exercise Band Dorsiflexion,Mollets,"{""setup"":[""Placez-vous face à un banc ou une chaise pour vous appuyer."",""Prenez la bande d'exercice et placez-la autour de votre cheville."",""Assurez-vous que la bande est bien ajustée mais pas trop serrée.""],""movement"":[""Poussez votre cheville vers le haut en gardant le genou plié."",""Retournez lentement à la position initiale."",""Répétez l'exercice plusieurs fois.""],""breathing"":[""Respirez profondément pendant la phase de poussée."",""Exhale lentement pendant la phase de retour.""],""common_mistakes"":[""Ne pliez pas trop le genou, cela peut entraîner des blessures."",""Assurez-vous que la bande est bien tendue pour une meilleure efficacité."",""Ne forcez pas trop, l'exercice doit être effectué de manière contrôlée.""]}",bodyweight,
a9b21057-970f-4435-870e-16699f6e1b15,Bande d'exercice plantarflexion,Exercise Band Plantarflexion,Mollets,"{""setup"":[""Placez-vous face à un banc ou une chaise pour vous appuyer."",""Prenez la bande d'exercice autour de la base de vos orteils."",""Évitez de laisser la bande toucher le sol."",""Assurez-vous que la bande est bien tendue mais pas trop.""],""movement"":[""Poussez vos orteils vers le haut en tirant sur la bande."",""Conservez vos genoux et vos chevilles immobiles."",""Ralentissez le mouvement en revenant lentement à la position initiale."",""Répétez l'exercice plusieurs fois.""],""breathing"":[""Respirez profondément pendant le mouvement de poussée."",""Exhale doucement pendant le retour à la position initiale.""],""common_mistakes"":[""Ne pas maintenir la bande tendue tout au long de l'exercice."",""Utiliser les genoux ou les chevilles pour aider à l'exécution de l'exercice."",""Ne pas contrôler le mouvement de retour à la position initiale.""]}",bodyweight,Mollets
54acabb2-1176-4ad7-a670-230a86a900d3,Bande en caoutchouc fessière kickback,rubber band glute kickback,Fessiers,"{""setup"":[""Placez-vous à genoux avec les mains sous les épaules et les genoux au niveau des hanches."",""Pliez-vous légèrement en arrière, formant un angle de 45 degrés avec le sol."",""Placez le band autour de vos chevilles."",""Assurez-vous que le band est bien tendu et stable.""],""movement"":[""Poussez votre jambe droite en arrière tout en gardant le genou droit tendu."",""Ramenez votre jambe droite vers le centre et répétez avec la jambe gauche."",""Concentrez-vous sur un mouvement lent et contrôlé."",""Répétez pour 10 à 15 répétitions par jambe.""],""breathing"":[""Respirez profondément et régulièrement tout au long de l'exercice."",""Inspirez lorsque vous ramenez la jambe et expirez lorsque vous la poussez en arrière.""],""common_mistakes"":[""Ne pliez pas le genou de la jambe qui est en arrière."",""Ne poussez pas trop fort pour éviter de se blesser."",""Assurez-vous que le band est bien tendu et stable pour éviter un mouvement inutile.""]}",band,
456756f2-be1e-47f4-818c-0b0d785929db,Bear crawl tirage,Bear crawl pull through,Épaules,"{""setup"":[""Commencez en position de crawl dourillon, genoux légèrement pliés."",""Hissez-vous sur vos mains et genoux, avec un dumbbell entre vos jambes."",""Assurez-vous que votre corps forme une ligne droite de la tête aux chevilles."",""Placez vos mains à environ 30 cm devant vos genoux.""],""movement"":[""Poussez-vous en arrière en tirant le dumbbell vers vos fesses."",""Pendant le mouvement, maintenez votre corps droit et vos genoux légèrement pliés."",""Poussez-vous en arrière jusqu'à ce que vos bras soient étirés derrière vous."",""Rappelez-vous de ne pas lever vos fesses au-dessus du niveau de vos épaules.""],""breathing"":[""Respirez profondément pendant l'extension et expirez pendant l'approche."",""Assurez-vous de ne pas retenir votre respiration.""],""common_mistakes"":[""Ne pas maintenir une ligne droite du corps."",""Lever les fesses au-dessus du niveau des épaules."",""Ne pas utiliser le dumbbell correctement, ce qui peut entraîner une mauvaise posture.""]}",dumbbell,Ischios; Mollets; Trapèzes
7a446572-b43b-42df-9b44-4e6279ac0f33,Bear walk 2,Bear Walk 2,Épaules,"{""setup"":[""Commencez en position de poule, genoux légèrement fléchis."",""Placez vos mains à hauteur de vos épaules, écartez-les légèrement."",""Écartez vos jambes pour former un angle de 45 degrés."",""Assurez-vous que vos pieds sont à plat et que vos genoux sont alignés avec vos orteils.""],""movement"":[""Poussez-vous en utilisant vos épaules et vos mains."",""Avancez en alternant les mains et les pieds."",""Conservez une posture droite tout au long de l'exercice."",""Faites attention à ce que vos hanches restent en ligne droite.""],""breathing"":[""Respirez profondément et régulièrement."",""Inspirez lorsque vous vous propulsez en avant."",""Exhalez lors de la phase de repos entre les mouvements.""],""common_mistakes"":[""Ne pas maintenir une posture droite peut entraîner des douleurs dans le dos."",""Utiliser trop de force avec les jambes peut entraîner une mauvaise technique."",""Ne pas alterner correctement les mains et les pieds peut réduire l'efficacité de l'exercice."",""Respirer de manière incorrecte peut limiter la performance et l'efficacité de l'exercice.""]}",bodyweight,Fessiers; Dos; Abdos; Quadriceps; Trapèzes
c4717a52-d3b4-4afb-8d0b-0315964159ab,Bent high pulls,Bent High Pulls,Trapèzes,"{""setup"":[""Prenez une barre de haltère avec les pieds largement écartés."",""Baissez le buste en arrière, formant un angle de 15 à 30 degrés avec le sol."",""Gardez les genoux légèrement fléchis et les bras tendus."",""Placez les mains sur la barre de manière confortable.""],""movement"":[""Poussez avec vos jambes pour lever la barre vers votre poitrine."",""Concentrez-vous sur l'ascension lente et contrôlée de la barre."",""Lorsque la barre atteint votre poitrine, concentrez-vous sur les trapèzes."",""Laissez la barre descendre lentement en contrôlant le mouvement.""],""breathing"":[""Respirez profondément pendant la phase de descente."",""Exhale lentement lorsque vous poussez la barre vers vous.""],""common_mistakes"":[""Ne pas utiliser les jambes pour lever la barre."",""Faire des mouvements rapides et non contrôlés."",""Ne pas maintenir une position de tronc stable."",""Utiliser un poids trop lourd pour effectuer le mouvement.""]}",dumbbell,
c056a834-553b-467b-9bb5-96b675c44a42,Bird dog,Bird Dog,Abdos,"{""setup"":[""Commencez sur vos genoux avec vos mains sous vos épaules et vos genoux sous vos hanches."",""Assurez-vous que votre dos est plat et que votre corps forme une ligne droite."",""Relâchez votre tête et laissez-la reposer naturellement."",""Assurez-vous que vos genoux sont légèrement fléchis pour éviter les blessures.""],""movement"":[""Lever simultanément votre main droite et votre jambe gauche."",""Maintenez cette position pendant une seconde."",""Ralentissez le mouvement en revenant à la position de départ."",""Répétez l'exercice avec votre main gauche et votre jambe droite.""],""breathing"":[""Respirez profondément et régulièrement tout au long de l'exercice."",""Inspirez lorsque vous vous étirez et expirez lorsque vous revenez à la position de départ.""],""common_mistakes"":[""Ne pas maintenir une ligne droite du corps, ce qui peut causer des douleurs dans le dos."",""Faire des mouvements rapides et brusques au lieu de les effectuer lentement et avec contrôle."",""Ne pas utiliser les muscles du dos pour maintenir la position, ce qui peut entraîner une mauvaise posture.""]}",bodyweight,Épaules; Fessiers
042b4b24-aede-4134-8bab-77f7b71e23ad,Blaze,Blaze,Épaules,"{""setup"":[""Installez-vous sur le banc, les pieds posés à plat sur le sol"",""Tenez les haltères avec les paumes tournées vers l'avant"",""Gardez le dos droit et les épaules basses""],""movement"":[""Levez les bras sur les côtés jusqu'à l'horizontal"",""Maintenez les coudes légèrement pliés"",""Baissez les bras à leur position initiale de manière contrôlée""],""breathing"":[""Inspirez en baissant les bras"",""Expirez en levant les bras vers l'horizontal"",""Respirez de manière naturelle et régulière""],""common_mistakes"":[""Ne laissez pas les épaules monter vers les oreilles"",""Évitez de plier ou de tendre les coudes de manière excessive"",""Gardez le mouvement fluide et contrôlé tout au long de l'exercice""]}",bench,Biceps; Ischios; Dos; Abdos
